{"$schema":"https://json-schema.org/draft/2020-12/schema","$id":"https://kaveep.dev/dev-agent/schemas/reviewed-change-artifact.schema.json","title":"KAVEEP DEV-AGENT Reviewed Change Artifact","type":"object","required":["reviewedChangeId","schemaVersion","reviewRequestRef","sandboxId","proposalRef","loopResultRef","status","sourceSnapshotVerified","changes","patch","patchSha256","warnings","errors","limitations","requiresHumanApproval","artifactAuthorizesSourceWrite","createdAt","recommendedNextAction"],"properties":{"reviewedChangeId":{"type":"string","pattern":"^reviewed_change_[A-Za-z0-9][A-Za-z0-9_-]*$"},"schemaVersion":{"type":"string","const":"1.0.0"},"reviewRequestRef":{"type":"string","pattern":"^reviewed_change_request_[A-Za-z0-9][A-Za-z0-9_-]*$"},"sandboxId":{"type":"string","pattern":"^sandbox_[A-Za-z0-9][A-Za-z0-9_-]*$"},"proposalRef":{"type":"string","pattern":"^engineering_proposal_[A-Za-z0-9][A-Za-z0-9_-]*$"},"loopResultRef":{"type":"string","pattern":"^engineering_loop_result_[A-Za-z0-9][A-Za-z0-9_-]*$"},"status":{"type":"string","enum":["ready_for_review","blocked","no_changes"]},"sourceSnapshotVerified":{"type":"boolean"},"changes":{"type":"array","items":{"type":"object","required":["path","changeType","beforeSha256","afterSha256","beforeBytes","afterBytes"],"properties":{"path":{"type":"string","minLength":1},"changeType":{"type":"string","enum":["added","modified","deleted"]},"beforeSha256":{"type":["string","null"],"pattern":"^[a-f0-9]{64}$"},"afterSha256":{"type":["string","null"],"pattern":"^[a-f0-9]{64}$"},"beforeBytes":{"type":"integer","minimum":0},"afterBytes":{"type":"integer","minimum":0}},"additionalProperties":false}},"patch":{"type":"string"},"patchSha256":{"type":"string","pattern":"^[a-f0-9]{64}$"},"warnings":{"type":"array","items":{"type":"string"}},"errors":{"type":"array","items":{"type":"string"}},"limitations":{"type":"array","items":{"type":"string"}},"requiresHumanApproval":{"type":"boolean","const":true},"artifactAuthorizesSourceWrite":{"type":"boolean","const":false},"createdAt":{"type":"string","format":"date-time"},"recommendedNextAction":{"type":"string","enum":["human_review","block_request","no_action"]}},"additionalProperties":false}
