{"reviewedChangeId":"reviewed_change_example_001","schemaVersion":"1.0.0","reviewRequestRef":"reviewed_change_request_example_001","sandboxId":"sandbox_example_001","proposalRef":"engineering_proposal_example_001","loopResultRef":"engineering_loop_result_example_001","status":"ready_for_review","sourceSnapshotVerified":true,"changes":[{"path":"src/index.mjs","changeType":"modified","beforeSha256":"aaaaaaaaaaaaaaaaaaaaaaaaaaaaaaaaaaaaaaaaaaaaaaaaaaaaaaaaaaaaaaaa","afterSha256":"bbbbbbbbbbbbbbbbbbbbbbbbbbbbbbbbbbbbbbbbbbbbbbbbbbbbbbbbbbbbbbbb","beforeBytes":24,"afterBytes":24}],"patch":"--- a/src/index.mjs\n+++ b/src/index.mjs\n@@ -1 +1 @@\n-export const value = 1;\n+export const value = 2;\n","patchSha256":"cccccccccccccccccccccccccccccccccccccccccccccccccccccccccccccccc","warnings":[],"errors":[],"limitations":["Review evidence does not authorize source write-back."],"requiresHumanApproval":true,"artifactAuthorizesSourceWrite":false,"createdAt":"2026-07-11T00:00:00.000Z","recommendedNextAction":"human_review"}
